{
  "$schema": "./src/fullstack-forge/schemas/skill.schema.json",
  "name": "fullstack-forge",
  "version": "0.3.1",
  "license": "Apache-2.0",
  "description": "Automatically guide AI coding agents through production-ready full-stack software-engineering changes; explicit Forge commands remain optional.",
  "entrypoint": "src/fullstack-forge/SKILL.md",
  "moduleCatalog": "config/modules.json",
  "platforms": ["agents", "claude", "gemini", "cursor", "windsurf", "github"]
}
